{"version":"allowlist.v1","enabled":false,"mode":"deny_by_default","rules":[{"id":"internal-biologyaqa-v1-explanatory","enabled":true,"appliesTo":{"subject":["Biology"],"level":["GCSE"],"board":["AQA"],"specVersion":["v1"]},"kinds":["explanatory"],"slotIds":[],"maxJobsPerRun":5},{"id":"phase9f-revision","enabled":true,"appliesTo":{"subject":["Biology"],"level":["GCSE"],"board":["AQA","Edexcel","OCR","WJEC"],"specVersion":["v1"]},"kinds":["revision"],"slotIds":[],"maxJobsPerRun":1}]}
